{
  "definition": {
    "id": "story",
    "version": "1"
  },
  "scope": {
    "kind": "ac",
    "ids": [
      "US-01.AC-01"
    ],
    "revision": "49ab152c81062c0a429dd64b78c59ca1ec070f58f1c52823a36a7011906e3402"
  },
  "states": {
    "eval": "PASS",
    "review": "PASS",
    "human": "PENDING",
    "freshness": "CURRENT",
    "progress": "draft",
    "delivery": "draft"
  },
  "receipts": [
    "receipt-spec"
  ],
  "rounds": {
    "cycle": "cycle-1",
    "eval_fix": 0,
    "review": 1,
    "max_fix": 3,
    "max_review": 3,
    "continuation": null
  },
  "decision": null,
  "exception_ids": [],
  "candidate": {
    "head": "fixture-head",
    "base": "fixture-base",
    "manifest": "4b7775b8e926745757bd6e1f594a7532bcc27376404e81918d15c95bf028b25a",
    "build": "not-built"
  }
}
